text_a	label
the script is smart and dark - hallelujah for small favors .	1
city by the sea is a gritty police thriller with all the dysfunctional family dynamics one could wish for .	1
some body is a shaky , uncertain film that nevertheless touches a few raw nerves .	1
as a kind of colorful , dramatized pbs program , frida gets the job done .	1
some fine acting , but ultimately a movie with no reason for being .	0
a straight-ahead thriller that never rises above superficiality .	0
the film is grossly contradictory in conveying its social message , if indeed there is one .	0
the feature-length stretch ... strains the show 's concept .	0
